{
  "account": {
    "slug": "acme-staffing",
    "name": "Acme Staffing",
    "kind": "staffing"
  },
  "attributes": [
    {
      "name": "worker.status",
      "valueType": "string",
      "cardinality": "one",
      "description": "Worker employment status."
    },
    {
      "name": "everify.status",
      "valueType": "string",
      "cardinality": "one",
      "description": "E-Verify workflow status."
    },
    {
      "name": "i9/citizenship",
      "valueType": "string",
      "cardinality": "one",
      "description": "I-9 citizenship status."
    },
    {
      "name": "role",
      "valueType": "string",
      "cardinality": "one",
      "description": "Job role."
    },
    {
      "name": "worker",
      "valueType": "entityRef",
      "cardinality": "one",
      "description": "The worker on a placement."
    },
    {
      "name": "employer",
      "valueType": "entityRef",
      "cardinality": "one",
      "description": "The employer on a placement."
    },
    {
      "name": "client",
      "valueType": "entityRef",
      "cardinality": "one",
      "description": "The client on a placement."
    },
    {
      "name": "job",
      "valueType": "entityRef",
      "cardinality": "one",
      "description": "The job on a placement."
    },
    {
      "name": "venue",
      "valueType": "entityRef",
      "cardinality": "one",
      "description": "The venue on a placement."
    }
  ],
  "entityTypes": [
    {
      "name": "Worker",
      "attributes": ["name", "worker.status", "everify.status", "i9/citizenship"],
      "description": "A staffed worker."
    },
    {
      "name": "Employer",
      "attributes": ["name"],
      "description": "A staffing agency / employer of record."
    },
    {
      "name": "Client",
      "attributes": ["name"],
      "description": "A client site a worker is placed at."
    },
    {
      "name": "Job",
      "attributes": ["name", "role"],
      "description": "A job role."
    },
    {
      "name": "Venue",
      "attributes": ["name"],
      "description": "A physical venue."
    },
    {
      "name": "Placement",
      "attributes": ["worker", "employer", "client", "job", "venue"],
      "description": "A worker placed by an employer at a client/job/venue."
    }
  ],
  "forms": [
    {
      "form": "i9",
      "title": "Form I-9",
      "fields": [
        {
          "name": "ssn",
          "label": "SSN",
          "type": "string",
          "required": true,
          "pii": true
        },
        {
          "name": "citizenship",
          "label": "Citizenship",
          "type": "select",
          "options": ["citizen", "permanent_resident", "authorized_alien"],
          "required": true
        }
      ]
    },
    {
      "form": "handbook",
      "title": "Employee Handbook Acknowledgement",
      "fields": [
        {
          "name": "acknowledged",
          "label": "I acknowledge",
          "type": "boolean",
          "required": true
        }
      ]
    },
    {
      "form": "forklift",
      "title": "Forklift Certification",
      "fields": [
        {
          "name": "acknowledged",
          "label": "I acknowledge",
          "type": "boolean",
          "required": true
        }
      ]
    },
    {
      "form": "venue_disclosure",
      "title": "Venue Disclosure",
      "fields": [
        {
          "name": "acknowledged",
          "label": "I acknowledge",
          "type": "boolean",
          "required": true
        }
      ]
    }
  ],
  "flows": [
    {
      "name": "onboarding",
      "title": "Worker onboarding",
      "subjectType": "Worker",
      "startStepId": "i9",
      "steps": [
        {
          "id": "i9",
          "type": "collect",
          "config": {
            "form": "i9",
            "scopeFrom": "employer"
          },
          "next": "branch"
        },
        {
          "id": "branch",
          "type": "branch",
          "config": {
            "where": [["?s", "i9/citizenship", "authorized_alien"]],
            "ifTrue": "everify",
            "ifFalse": "welcome"
          }
        },
        {
          "id": "everify",
          "type": "action",
          "config": {
            "label": "E-Verify check",
            "resultAttr": "everify.status",
            "resultValue": "verified"
          },
          "next": "welcome"
        },
        {
          "id": "welcome",
          "type": "notify",
          "config": {
            "message": "Welcome aboard!"
          },
          "next": "done"
        },
        {
          "id": "done",
          "type": "done"
        }
      ]
    }
  ],
  "requirements": [
    {
      "form": "i9",
      "scopeAttr": "employer",
      "validityDays": 1095
    },
    {
      "form": "handbook",
      "scopeAttr": "client"
    },
    {
      "form": "forklift",
      "scopeAttr": "job",
      "guard": ["role", "forklift"]
    },
    {
      "form": "venue_disclosure",
      "scopeAttr": "venue"
    }
  ],
  "actions": [
    {
      "name": "terminate",
      "label": "Terminate worker",
      "appliesTo": "Worker",
      "asserts": {
        "worker.status": "terminated"
      }
    },
    {
      "name": "reactivate",
      "label": "Reactivate worker",
      "appliesTo": "Worker",
      "asserts": {
        "worker.status": "active"
      }
    }
  ]
}
